{
  "$schema": "https://json-schema.org/draft/2020-12/schema",
  "type": "object",
  "additionalProperties": false,
  "required": [
    "schema_version",
    "record_type",
    "request_id",
    "request_digest",
    "intent",
    "completed_steps",
    "tls_identity_sha256"
  ],
  "properties": {
    "schema_version": {
      "const": 3
    },
    "record_type": {
      "const": "controller-service-setup"
    },
    "request_id": {
      "type": "string",
      "pattern": "^[A-Za-z0-9][A-Za-z0-9_.-]{0,127}$"
    },
    "request_digest": {
      "type": "string",
      "pattern": "^[0-9a-f]{64}$"
    },
    "intent": {
      "type": "object",
      "additionalProperties": false,
      "required": [
        "initial_intent",
        "setup_request_digest"
      ],
      "properties": {
        "initial_intent": {
          "type": "object",
          "additionalProperties": false,
          "required": [
            "cache_gib",
            "reserve_gib",
            "host",
            "port",
            "allow_lan",
            "logout_policy",
            "runtime_archive_sha256",
            "runtime_manifest_sha256",
            "runtime_version"
          ],
          "properties": {
            "cache_gib": {
              "type": "integer",
              "minimum": 0,
              "maximum": 1048576
            },
            "reserve_gib": {
              "type": "number",
              "minimum": 0,
              "maximum": 1048576
            },
            "host": {
              "type": "string",
              "maxLength": 45,
              "anyOf": [
                {
                  "format": "ipv4"
                },
                {
                  "format": "ipv6"
                }
              ]
            },
            "port": {
              "type": "integer",
              "minimum": 1,
              "maximum": 65535
            },
            "allow_lan": {
              "type": "boolean"
            },
            "logout_policy": {
              "enum": [
                "session",
                "existing_linger"
              ]
            },
            "runtime_archive_sha256": {
              "anyOf": [
                {
                  "type": "null"
                },
                {
                  "type": "string",
                  "pattern": "^[0-9a-f]{64}$"
                }
              ]
            },
            "runtime_manifest_sha256": {
              "anyOf": [
                {
                  "type": "null"
                },
                {
                  "type": "string",
                  "pattern": "^[0-9a-f]{64}$"
                }
              ]
            },
            "runtime_version": {
              "type": [
                "string",
                "null"
              ],
              "pattern": "^[0-9][A-Za-z0-9.+-]{0,63}$"
            }
          },
          "allOf": [
            {
              "then": {
                "properties": {
                  "runtime_archive_sha256": {
                    "type": "null"
                  },
                  "runtime_manifest_sha256": {
                    "type": "null"
                  }
                }
              },
              "else": {
                "properties": {
                  "runtime_archive_sha256": {
                    "type": "string",
                    "pattern": "^[0-9a-f]{64}$"
                  },
                  "runtime_manifest_sha256": {
                    "type": "string",
                    "pattern": "^[0-9a-f]{64}$"
                  }
                }
              }
            },
            {
              "if": {
                "properties": {
                  "allow_lan": {
                    "const": false
                  }
                }
              },
              "then": {
                "properties": {
                  "host": {
                    "anyOf": [
                      {
                        "pattern": "^127\\."
                      },
                      {
                        "const": "::1"
                      }
                    ]
                  }
                }
              }
            }
          ]
        },
        "setup_request_digest": {
          "type": "string",
          "pattern": "^[0-9a-f]{64}$"
        }
      }
    },
    "completed_steps": {
      "enum": [
        [],
        [
          "tls_ready"
        ],
        [
          "tls_ready",
          "configuration_published"
        ]
      ]
    },
    "tls_identity_sha256": {
      "oneOf": [
        {
          "type": "string",
          "pattern": "^[0-9a-f]{64}$"
        },
        {
          "type": "null"
        }
      ]
    }
  }
}
