{
  "schema_version": 3,
  "record_type": "controller-service-setup",
  "request_id": "initial-setup",
  "request_digest": "a930413b98e90b5a4bea2ee62dfb3918d7bcc58b82856885ae83edee037f1090",
  "intent": {
    "initial_intent": {
      "cache_gib": 50,
      "reserve_gib": 20.0,
      "host": "127.0.0.1",
      "port": 8443,
      "allow_lan": false,
      "logout_policy": "session",
      "runtime_archive_sha256": "aaaaaaaaaaaaaaaaaaaaaaaaaaaaaaaaaaaaaaaaaaaaaaaaaaaaaaaaaaaaaaaa",
      "runtime_manifest_sha256": "bbbbbbbbbbbbbbbbbbbbbbbbbbbbbbbbbbbbbbbbbbbbbbbbbbbbbbbbbbbbbbbb",
      "runtime_version": "0.1.0"
    },
    "setup_request_digest": "d269e9e22c2af29124c952a9b726f4ca3e6d7d0ac82873794a1ce812e546f4d8"
  },
  "completed_steps": [],
  "tls_identity_sha256": null
}
